{
  "$schema": "./theme.schema.json",
  "meta": {
    "name": "dark",
    "authority": ".spec/prds/v2/concepts/uc-tok-02-colors.html"
  },
  "surface": {
    "primary":  "#221810",
    "card":     "#2D2218",
    "inset":    "#362A1F",
    "overlay":  "rgba(45,34,24,0.92)",
    "glass":    "rgba(45,34,24,0.72)",
    "scrim":    "rgba(10,6,3,0.50)",
    "map":      "#2D2218"
  },
  "content": {
    "primary":   "#F2EEE8",
    "secondary": "#CAC4D0",
    "tertiary":  "#9CA3AF",
    "subtle":    "#6B6460",
    "on-signal": "#FFFFFF"
  },
  "border": {
    "default": "rgba(242,238,232,0.12)",
    "subtle":  "rgba(242,238,232,0.07)",
    "strong":  "rgba(242,238,232,0.22)",
    "focus":   "#EE7C2B",
    "glass":   "rgba(242,238,232,0.22)"
  },
  "signal": {
    "default": "#EE7C2B",
    "hover":   "#F3A164",
    "pressed": "#9E4A22",
    "tint":    "#F9D5B5",
    "whisper": "#FCE8D4"
  },
  "action": {
    "primary":          "#EE7C2B",
    "primary-hover":    "#F3A164",
    "primary-pressed":  "#9E4A22",
    "primary-disabled": "#3D3228"
  },
  "role": {
    "agent":  "#EE7C2B",
    "user":   "#F2EFED",
    "system": "#E5DED9"
  },
  "status": {
    "info":         "#3A8BE3",
    "info-tint":    "rgba(58,139,227,0.18)",
    "success":      "#4D8470",
    "success-tint": "rgba(77,132,112,0.22)",
    "warning":      "#C46F1B",
    "warning-tint": "rgba(196,111,27,0.22)",
    "error":        "#C9423C",
    "error-tint":   "rgba(201,66,60,0.22)",
    "recording":    "#C9423C"
  },
  "weather": {
    "clear":      "#E6A52A", "clear-tint":  "#FBEFCF",
    "rain":       "#4A86BE", "rain-tint":   "#DBEAF4",
    "wind":       "#6B7B8F", "wind-tint":   "#E1E6EC",
    "storm":      "#5E3FAE", "storm-tint":  "#E3DCF2",
    "hot":        "#C9423C", "hot-tint":    "#F5D8D6",
    "cold":       "#3A8BE3", "cold-tint":   "#D6E5F7"
  },
  "route": {
    "best": "#EE7C2B",
    "alt1": "#4D8470",
    "alt2": "#6B7B8F"
  },
  "map": {
    "paper":         "#2D2218",
    "contour":       "rgba(242,238,232,0.22)",
    "contour-faint": "rgba(242,238,232,0.10)"
  },
  "elev": {
    "card":    "0 2px 6px rgba(0,0,0,0.24)",
    "chrome":  "0 1px 3px rgba(0,0,0,0.24), 0 4px 14px rgba(0,0,0,0.28)",
    "overlay": "0 8px 24px rgba(0,0,0,0.42), 0 2px 6px rgba(0,0,0,0.28)"
  },
  "duration": {
    "instant":    0,
    "fast":       120,
    "standard":   240,
    "slow":       400,
    "deliberate": 600
  },
  "ease": {
    "standard":    "cubic-bezier(0.4,0.0,0.2,1.0)",
    "emphasized":  "cubic-bezier(0.2,0.0,0.0,1.0)",
    "decelerated": "cubic-bezier(0.0,0.0,0.2,1.0)",
    "accelerated": "cubic-bezier(0.4,0.0,1.0,1.0)",
    "linear":      "linear"
  },
  "radius": {
    "none": 0, "xs": 2, "sm": 4, "md": 6, "lg": 10, "xl": 16, "2xl": 18, "pill": 999
  },
  "space": {
    "0": 0, "1": 2, "2": 4, "3": 8, "4": 12, "5": 16,
    "6": 20, "7": 24, "8": 32, "9": 40, "10": 48, "11": 56, "12": 64
  },
  "size": {
    "touch-min":    44,
    "control-sm":   28,
    "control-md":   36,
    "control-lg":   48,
    "control-chat": 54,
    "control-xl":   56,
    "icon-xs": 12, "icon-sm": 16, "icon-md": 18, "icon-lg": 24, "icon-xl": 32,
    "avatar-xs": 20, "avatar-sm": 28, "avatar-md": 36, "avatar-lg": 48, "avatar-xl": 64
  },
  "stroke": {
    "sm": 1, "md": 1.5, "lg": 2
  },
  "opacity": {
    "0": 0, "subtle": 0.08, "focus": 0.12, "disabled": 0.38,
    "overlay": 0.60, "dim": 0.76, "veil": 0.92, "1": 1
  }
}
